Номер_id,Заголовок,Почта
1,id labore ex et quam laborum,Eliseo@gardner.biz
2,quo vero reiciendis velit similique earum,Jayne_Kuhic@sydney.com
3,odio adipisci rerum aut animi,Nikita@garfield.biz
4,alias odio sit,Lew@alysha.tv
5,vero eaque aliquid doloribus et culpa,Hayden@althea.biz
6,et fugit eligendi deleniti quidem qui sint nihil autem,Presley.Mueller@myrl.com
7,repellat consequatur praesentium vel minus molestias voluptatum,Dallas@ole.me
8,et omnis dolorem,Mallory_Kunze@marie.org
9,provident id voluptas,Meghan_Littel@rene.us
10,eaque et deleniti atque tenetur ut quo ut,Carmen_Keeling@caroline.name
11,fugit labore quia mollitia quas deserunt nostrum sunt,Veronica_Goodwin@timmothy.net
12,modi ut eos dolores illum nam dolor,Oswald.Vandervort@leanne.org
13,aut inventore non pariatur sit vitae voluptatem sapiente,Kariane@jadyn.tv
14,et officiis id praesentium hic aut ipsa dolorem repudiandae,Nathan@solon.io
15,debitis magnam hic odit aut ullam nostrum tenetur,Maynard.Hodkiewicz@roberta.com
16,perferendis temporibus delectus optio ea eum ratione dolorum,Christine@ayana.info
17,eos est animi quis,Preston_Hudson@blaise.tv
18,aut et tenetur ducimus illum aut nulla ab,Vincenza_Klocko@albertha.name
19,sed impedit rerum quia et et inventore unde officiis,Madelynn.Gorczany@darion.biz
20,molestias expedita iste aliquid voluptates,Mariana_Orn@preston.org
21,aliquid rerum mollitia qui a consectetur eum sed,Noemie@marques.me
22,porro repellendus aut tempore quis hic,Khalil@emile.co.uk
23,quis tempora quidem nihil iste,Sophia@arianna.co.uk
24,in tempore eos beatae est,Jeffery@juwan.us
25,autem ab ea sit alias hic provident sit,Isaias_Kuhic@jarrett.net
26,in deleniti sunt provident soluta ratione veniam quam praesentium,Russel.Parker@kameron.io
27,doloribus quibusdam molestiae amet illum,Francesco.Gleason@nella.us
28,quo voluptates voluptas nisi veritatis dignissimos dolores ut officiis,Ronny@rosina.org
29,eum distinctio amet dolor,Jennings_Pouros@erica.biz
30,quasi nulla ducimus facilis non voluptas aut,Lurline@marvin.biz
31,ex velit ut cum eius odio ad placeat,Buford@shaylee.biz
32,dolorem architecto ut pariatur quae qui suscipit,Maria@laurel.name
33,voluptatum totam vel voluptate omnis,Jaeden.Towne@arlene.tv
34,omnis nemo sunt ab autem,Ethelyn.Schneider@emelia.co.uk
35,repellendus sapiente omnis praesentium aliquam ipsum id molestiae omnis,Georgianna@florence.io
36,sit et quis,Raheem_Heaney@gretchen.biz
37,beatae veniam nemo rerum voluptate quam aspernatur,Jacky@victoria.net
38,maiores dolores expedita,Piper@linwood.us
39,necessitatibus ratione aut ut delectus quae ut,Gaylord@russell.net
40,non minima omnis deleniti pariatur facere quibusdam at,Clare.Aufderhar@nicole.ca
41,voluptas deleniti ut,Lucio@gladys.tv
42,nam qui et,Shemar@ewell.name
43,molestias sint est voluptatem modi,Jackeline@eva.tv
44,hic molestiae et fuga ea maxime quod,Marianna_Wilkinson@rupert.io
45,autem illo facilis,Marcia@name.biz
46,dignissimos et deleniti voluptate et quod,Jeremy.Harann@waino.me
47,rerum commodi est non dolor nesciunt ut,Pearlie.Kling@sandy.com
48,consequatur animi dolorem saepe repellendus ut quo aut tenetur,Manuela_Stehr@chelsie.tv
49,rerum placeat quae minus iusto eligendi,Camryn.Weimann@doris.io
50,dolorum soluta quidem ex quae occaecati dicta aut doloribus,Kiana_Predovic@yasmin.io
51,molestias et odio ut commodi omnis ex,Laurie@lincoln.us
52,esse autem dolorum,Abigail.OConnell@june.org
53,maiores alias necessitatibus aut non,Laverne_Price@scotty.info
54,culpa eius tempora sit consequatur neque iure deserunt,Kenton_Vandervort@friedrich.com
55,quas pariatur quia a doloribus,Hayden_Olson@marianna.me
56,et dolorem corrupti sed molestias,Vince_Crist@heidi.biz
57,qui quidem sed,Darron.Nikolaus@eulah.me
58,sint minus reiciendis qui perspiciatis id,Ezra_Abshire@lyda.us
59,quis ducimus distinctio similique et illum minima ab libero,Jameson@tony.info
60,expedita libero quos cum commodi ad,Americo@estrella.net
61,quidem itaque dolores quod laborum aliquid molestiae,Aurelio.Pfeffer@griffin.ca
62,libero beatae consequuntur optio est hic,Vesta_Crooks@dora.us
63,occaecati dolor accusantium et quasi architecto aut eveniet fugiat,Margarett_Klein@mike.biz
64,consequatur aut ullam voluptas dolorum voluptatum sequi et,Freida@brandt.tv
65,earum ea ratione numquam,Mollie@agustina.name
66,eius nam consequuntur,Janice@alda.io
67,omnis consequatur natus distinctio,Dashawn@garry.com
68,architecto ut deserunt consequatur cumque sapiente,Devan.Nader@ettie.me
69,at aut ea iure accusantium voluptatum nihil ipsum,Joana.Schoen@leora.co.uk
70,eum magni accusantium labore aut cum et tenetur,Minerva.Anderson@devonte.ca
71,vel pariatur perferendis vero ab aut voluptates labore,Lavinia@lafayette.me
72,quia sunt dolor dolor suscipit expedita quis,Sabrina.Marks@savanah.name
73,ut quia ipsa repellat sunt et sequi aut est,Desmond_Graham@kailee.biz
74,ut non illum pariatur dolor,Gussie_Kunde@sharon.biz
75,minus laboriosam consequuntur,Richard@chelsie.co.uk
76,porro ut soluta repellendus similique,Gage_Turner@halle.name
77,dolores et quo omnis voluptates,Alfred@sadye.biz
78,voluptas voluptas voluptatibus blanditiis,Catharine@jordyn.com
79,beatae ut ad quisquam sed repellendus et,Esther_Ratke@shayna.biz
80,et cumque ad culpa ut eligendi non,Evangeline@chad.net
81,aut non consequuntur dignissimos voluptatibus dolorem earum recusandae dolorem,Newton.Kertzmann@anjali.io
82,ea est non dolorum iste nihil est,Caleb_Herzog@rosamond.net
83,nihil qui accusamus ratione et molestias et minus,Sage_Mueller@candace.net
84,quia voluptatibus magnam voluptatem optio vel perspiciatis,Bernie.Bergnaum@lue.com
85,non voluptas cum est quis aut consectetur nam,Alexzander_Davis@eduardo.name
86,suscipit est sunt vel illum sint,Jacquelyn@krista.info
87,dolor asperiores autem et omnis quasi nobis,Grover_Volkman@coty.tv
88,officiis aperiam odit sint est non,Jovanny@abigale.ca
89,in voluptatum nostrum voluptas iure nisi rerum est placeat,Isac_Schmeler@barton.com
90,eum voluptas dolores molestias odio amet repellendus,Sandy.Erdman@sabina.info
91,repellendus est laboriosam voluptas veritatis,Alexandro@garry.io
92,repellendus aspernatur occaecati tempore blanditiis deleniti omnis qui distinctio,Vickie_Schuster@harley.net
93,mollitia dolor deleniti sed iure laudantium,Roma_Doyle@alia.com
94,vero repudiandae voluptatem nobis,Tatum_Marks@jaylon.name
95,voluptatem unde quos provident ad qui sit et excepturi,Juston.Ruecker@scot.tv
96,non sit ad culpa quis,River.Grady@lavada.biz
97,reiciendis culpa omnis suscipit est,Claudia@emilia.ca
98,praesentium dolorem ea voluptate et,Torrey@june.tv
99,laudantium delectus nam,Hildegard.Aufderhar@howard.com
100,et sint quia dolor et est ea nulla cum,Leone_Fay@orrin.com
101,perspiciatis magnam ut eum autem similique explicabo expedita,Lura@rod.tv
102,officia ullam ut neque earum ipsa et fuga,Lottie.Zieme@ruben.us
103,ipsum a ut,Winona_Price@jevon.me
104,a assumenda totam,Gabriel@oceane.biz
105,voluptatem repellat est,Adolph.Ondricka@mozell.co.uk
106,maiores placeat facere quam pariatur,Allen@richard.biz
107,in ipsam vel id impedit possimus eos voluptate,Nicholaus@mikayla.ca
108,ut veritatis corporis placeat suscipit consequatur quaerat,Kayla@susanna.org
109,eveniet ut similique accusantium qui dignissimos,Gideon@amina.name
110,sint est odit officiis similique aut corrupti quas autem,Cassidy@maribel.io
111,possimus facilis deleniti nemo atque voluptate,Stefan.Crist@duane.ca
112,dolore aut aspernatur est voluptate quia ipsam,Aniyah.Ortiz@monte.me
113,sint quo debitis deleniti repellat,Laverna@rico.biz
114,optio et sunt non,Derek@hildegard.net
115,occaecati dolorem eum in veniam quia quo reiciendis,Tyrell@abdullah.ca
116,veritatis sit tempora quasi fuga aut dolorum,Reyes@hailey.name
117,incidunt quae optio quam corporis iste deleniti accusantium vero,Danika.Dicki@mekhi.biz
118,quisquam laborum reiciendis aut,Alessandra.Nitzsche@stephania.us
119,minus pariatur odit,Matteo@marquis.net
120,harum error sit,Joshua.Spinka@toby.io
121,deleniti quo corporis ullam magni praesentium molestiae,Annabelle@cole.com
122,nihil tempora et reiciendis modi veniam,Kacey@jamal.info
123,ad eos explicabo odio velit,Mina@mallie.name
124,nostrum suscipit aut consequatur magnam sunt fuga nihil,Hudson.Blick@ruben.biz
125,porro et voluptate et reprehenderit,Domenic.Durgan@joaquin.name
126,fuga tenetur id et qui labore delectus,Alexie@alayna.org
127,consequatur harum magnam,Haven_Barrows@brant.org
128,labore architecto quaerat tempora voluptas consequuntur animi,Marianne@maximo.us
129,deleniti facere tempore et perspiciatis voluptas quis voluptatem,Fanny@danial.com
130,quod est non quia doloribus quam deleniti libero,Trevion_Kuphal@bernice.name
131,voluptas quasi sunt laboriosam,Emmet@guy.biz
132,unde tenetur vero eum iusto,Megane.Fritsch@claude.name
133,est adipisci laudantium amet rem asperiores,Amya@durward.ca
134,reiciendis quo est vitae dignissimos libero ut officiis fugiat,Jasen_Rempel@willis.org
135,inventore fugiat dignissimos,Harmony@reggie.com
136,et expedita est odit,Rosanna_Kunze@guy.net
137,saepe dolore qui tempore nihil perspiciatis omnis omnis magni,Ressie.Boehm@flossie.com
138,ea optio nesciunt officia velit enim facilis commodi,Domenic.Wuckert@jazmyne.us
139,ut pariatur voluptate possimus quasi,Rhett.OKon@brian.info
140,consectetur tempore eum consequuntur,Mathias@richmond.info
141,dignissimos perspiciatis voluptate quos rem qui temporibus excepturi,Ottis@lourdes.org
142,cum dolore sit quisquam provident nostrum vitae,Estel@newton.ca
143,velit molestiae assumenda perferendis voluptas explicabo,Bertha@erik.co.uk
144,earum ipsum ea quas qui molestiae omnis unde,Joesph@matteo.info
145,magni iusto sit,Alva@cassandre.net
146,est qui debitis,Vivienne@willis.org
147,reiciendis et consectetur officiis beatae corrupti aperiam,Angelita@aliza.me
148,iusto reprehenderit voluptatem modi,Timmothy_Okuneva@alyce.tv
149,optio dolorem et reiciendis et recusandae quidem,Moriah_Welch@richmond.org
150,id saepe numquam est facilis sint enim voluptas voluptatem,Ramiro_Kuhn@harmon.biz
151,ut quas facilis laborum voluptatum consequatur odio voluptate et,Cary@taurean.biz
152,quod doloremque omnis,Tillman_Koelpin@luisa.com
153,dolorum et dolorem optio in provident,Aleen@tania.biz
154,odit illo optio ea modi in,Durward@cindy.com
155,adipisci laboriosam repudiandae omnis veritatis in facere similique rem,Lester@chauncey.ca
156,pariatur omnis in,Telly_Lynch@karl.co.uk
157,aut nobis et consequatur,Makenzie@libbie.io
158,explicabo est molestiae aut,Amiya@perry.us
159,voluptas blanditiis deserunt quia quis,Meghan@akeem.tv
160,sint fugit esse,Mitchel.Williamson@fletcher.io
161,nesciunt quidem veritatis alias odit nisi voluptatem non est,Ashlee_Jast@emie.biz
162,animi vitae qui aut corrupti neque culpa modi,Antwan@lori.ca
163,omnis ducimus ab temporibus nobis porro natus deleniti,Estelle@valentina.info
164,eius corrupti ea,Haylie@gino.name
165,quia commodi molestiae assumenda provident sit incidunt laudantium,Blake_Spinka@robyn.info
166,sint alias molestiae qui dolor vel,Aimee.Bins@braeden.ca
167,ea nam iste est repudiandae,Eloy@vladimir.com
168,quis harum voluptatem et culpa,Gabrielle@jada.co.uk
169,dolor dolore similique tempore ducimus,Lee@dawn.net
170,cupiditate labore omnis consequatur,Gideon.Hyatt@jalen.tv
171,voluptatibus qui est et,Gerda.Reynolds@ceasar.co.uk
172,corporis ullam quo,Ivah@brianne.net
173,nulla accusamus saepe debitis cum,Ethyl_Bogan@candace.co.uk
174,iure praesentium ipsam,Janelle_Guann@americo.info
175,autem totam velit officiis voluptates et ullam rem,Alfonzo.Barton@kelley.co.uk
176,ipsam deleniti incidunt repudiandae voluptatem maxime provident non dolores,Esther@ford.me
177,ab cupiditate blanditiis ea sunt,Naomie_Cronin@rick.co.uk
178,rerum ex quam enim sunt,Darryl@reginald.us
179,et iure ex rerum qui,Thea@aurelio.org
180,autem tempora a iusto eum aut voluptatum,Carolyn@eloisa.biz
181,similique ut et non laboriosam in eligendi et,Milan.Schoen@cortney.io
182,soluta corporis excepturi consequatur perspiciatis quia voluptatem,Sabrina@raymond.biz
183,praesentium quod quidem optio omnis qui,Hildegard@alford.ca
184,veritatis velit quasi quo et voluptates dolore,Lowell.Pagac@omari.biz
185,natus assumenda ut,Vivianne@ima.us
186,voluptas distinctio qui similique quasi voluptatem non sit,Yasmin.Prohaska@hanna.co.uk
187,maiores iste dolor itaque nemo voluptas,Ursula.Kirlin@eino.org
188,quisquam quod quia nihil animi minima facere odit est,Nichole_Bartoletti@mozell.me
189,ut iusto asperiores delectus,Lottie_Wyman@jasen.biz
190,dignissimos voluptatibus libero,Dominique_Hermann@paige.ca
191,est perferendis eos dolores maxime rerum qui,Eugene@mohammed.net
192,sunt veritatis quisquam est et porro nesciunt excepturi a,Janick@marty.me
193,quia velit nostrum eligendi voluptates,Alena@deron.name
194,non ut sunt ut eius autem ipsa eos sapiente,Alphonso_Rosenbaum@valentin.co.uk
195,tempore vel accusantium qui quidem esse ut aut,Frank@rosalind.name
196,totam vel saepe aut qui velit quis,Jenifer_Lowe@reuben.ca
197,non perspiciatis omnis facere rem,Cecelia_Nitzsche@marty.com
198,quod vel enim sit quia ipsa quo dolores,Christop_Friesen@jordan.me
199,pariatur aspernatur nam atque quis,Cooper_Boehm@damian.biz
200,aperiam et omnis totam,Amir@kaitlyn.org
201,et adipisci aliquam a aperiam ut soluta,Cleve@royal.us
202,blanditiis vel fuga odio qui,Donnell@polly.net
203,ab enim adipisci laudantium impedit qui sed,Bonita@karl.biz
204,autem voluptates voluptas nihil,Shea@angelina.biz
205,et reiciendis ullam quae,Omari@veronica.us
206,deserunt eveniet quam vitae velit,Sophie@antoinette.ca
207,asperiores sed voluptate est,Jessika@crystel.ca
208,excepturi aut libero incidunt doloremque at,Cesar_Volkman@letitia.biz
209,repudiandae consectetur dolore,Maureen_Mueller@lance.us
210,quibusdam provident accusamus id aut totam eligendi,Eriberto@geovany.ca
211,rerum voluptate dolor,Faustino.Keeling@morris.co.uk
212,et maiores sed temporibus cumque voluptatem sunt necessitatibus in,Viola@aric.co.uk
213,ratione architecto in est voluptatem quibusdam et,Felton_Huel@terrell.biz
214,dicta deserunt tempore,Ferne_Bogan@angus.info
215,sint culpa cupiditate ut sit quas qui voluptas qui,Amy@reymundo.org
216,voluptatem esse sint alias,Jaylan.Mayert@norbert.biz
217,eos velit velit esse autem minima voluptas,Cristina.DAmore@destini.biz
218,voluptatem qui deserunt dolorum in voluptates similique et qui,Ettie_Bashirian@lambert.biz
219,qui unde recusandae omnis ut explicabo neque magni veniam,Lizeth@kellen.org
220,vel autem quia in modi velit,Vladimir_Schumm@sharon.tv
221,reprehenderit rem voluptatem voluptate recusandae dolore distinctio,Madonna@will.com
222,rerum aliquam ducimus repudiandae perferendis,Cicero_Goldner@elenor.tv
223,accusantium aliquid consequuntur minus quae quis et autem,Zella@jan.net
224,eum dolorum ratione vitae expedita,Robin_Jacobi@verdie.net
225,occaecati et corrupti expedita,Lawson@demarco.co.uk
226,assumenda officia quam ex natus minima sint quia,Benton@jayde.tv
227,omnis error aut doloremque ipsum ducimus,Melody@london.name
228,eaque expedita temporibus iure velit eligendi labore dignissimos molestiae,Wyman.Swaniawski@marjorie.name
229,maxime veniam at,Deborah@fletcher.co.uk
230,illo dolor corrupti quia pariatur in,Dario@barton.info
231,omnis minima dicta aliquam excepturi,Kelton_McKenzie@danial.us
232,voluptatem excepturi sit et sed qui ipsum quam consequatur,Itzel@fritz.io
233,qui dolores maxime autem enim repellendus culpa nostrum consequuntur,Jacquelyn_Kutch@kaya.co.uk
234,natus et necessitatibus animi,Cheyanne.Schowalter@alycia.biz
235,odio sed accusantium iure repudiandae officiis ut autem illo,Macey@abbie.org
236,cupiditate rerum voluptate quo facere repudiandae,Freeda.Kirlin@eddie.ca
237,recusandae deserunt possimus voluptatibus ipsam iste consequatur consequatur,Jennifer.Rowe@zoe.org
238,voluptatem nam ducimus non molestiae,Providenci.Heller@lenna.info
239,voluptatum debitis qui aut voluptas eos quibusdam et,Emerald_Murazik@darrell.biz
240,est dolorem est placeat provident non nihil,Joseph@corrine.com
241,reprehenderit inventore soluta ut aliquam,Lemuel@willow.name
242,quis sit aut vero quo accusamus,Sven@gudrun.info
243,quaerat natus illum,Jennifer@shania.ca
244,labore temporibus ipsa at blanditiis autem,Eldora@madge.com
245,et rerum fuga blanditiis provident eligendi iste eos,Litzy@kaylie.io
246,magnam earum qui eaque sunt excepturi,Jaycee.Turner@euna.name
247,vel aut blanditiis magni accusamus dolor soluta,Wilbert@cheyenne.ca
248,voluptatum sint dicta voluptas aut ut,Rebecca_Hessel@edna.net
249,quibusdam dignissimos aperiam sint commodi,Christiana@lawrence.info
250,perferendis magnam natus exercitationem eveniet sunt,Samara@shaun.org
251,veritatis sint eius,Ayden_Hickle@stephany.tv
252,qui alias beatae iusto omnis placeat recusandae ut,Carissa.Krajcik@jean.name
253,voluptate ipsum corporis quis provident voluptatem eos asperiores,Jayde@geovanny.io
254,velit inventore et eius saepe,Ardella@khalid.biz
255,impedit et sapiente et tempore repellendus,Delta_Welch@carleton.tv
256,tempore distinctio quam,Carlee_Heathcote@harley.tv
257,illum non quod vel voluptas quos,Delpha_Cormier@raymond.org
258,omnis quia fugit nisi officiis aspernatur occaecati et,Glenna@caesar.org
259,animi minima ducimus tempore officiis qui,Hoyt_Dickens@napoleon.ca
260,qui dolore delectus et omnis quia,Wendell.Marvin@maegan.net
261,aut veritatis quasi voluptatem enim dolor soluta temporibus,Virgie@layne.org
262,ipsa aliquid laborum quidem recusandae dolorum quia,Tia@kirsten.info
263,vitae voluptatem dolor iure quo non atque,Marco@jennyfer.biz
264,cum ab voluptates aut,Taya@milan.biz
265,omnis incidunt est molestias,Lenora@derrick.biz
266,eum enim provident atque eum,Carolina.Auer@polly.co.uk
267,ea commodi provident veritatis voluptatem voluptates aperiam,Jaylan.Braun@lane.us
268,eum et eos delectus,Javier.Dicki@damien.org
269,molestiae vitae pariatur,Khalil_Sawayn@tanya.net
270,rerum adipisci et ut sit sit dolores,Tom.Russel@pattie.org
271,et et repellat quasi non ea similique,Ethelyn.Moore@gabe.info
272,repudiandae ut velit dignissimos enim rem dolores odit,Evangeline_Kuvalis@santina.ca
273,et aperiam autem inventore nisi nulla reiciendis velit,Orland@larry.name
274,et vero nostrum tempore,Micaela.Powlowski@saul.me
275,error nulla est laudantium similique ad,Imelda_Klein@melany.biz
276,inventore amet ut debitis ipsam reiciendis molestiae autem sed,Matt.Moen@gilda.org
277,dolorem aut ipsum alias ex ea quidem nostrum,Rocky_Ullrich@rowena.name
278,est pariatur similique quod voluptas et consequuntur nam molestiae,Natalia@caitlyn.ca
279,voluptas nihil aut dolor adipisci non,Edythe@general.org
280,culpa minima non consequatur sit autem quas sed ipsam,Aglae@gerardo.name
281,consequatur voluptates sed voluptatem fuga,Bridie@pearl.ca
282,et vitae culpa corrupti,Aglae_Goldner@madisyn.co.uk
283,iste molestiae aut hic perspiciatis sint,Owen_Moore@jeremy.org
284,soluta omnis maiores animi veniam voluptas et totam repellendus,Jarred@dangelo.name
285,non est sunt consequatur reiciendis,Remington_Mohr@vincenza.me
286,dolore dignissimos distinctio,Marco.Langworth@zoie.org
287,voluptas ad autem maxime iusto eos dolorem ducimus est,Sedrick@mertie.tv
288,numquam eius voluptas quibusdam soluta exercitationem,Caleigh@eleanore.org
289,voluptatem aut harum aut corporis dignissimos occaecati sequi quod,Paolo@cristopher.com
290,suscipit debitis eveniet nobis atque commodi quisquam,Juana_Stamm@helmer.com
291,occaecati et dolorum,Pascale@fleta.ca
292,consequatur et facere similique beatae explicabo eligendi consequuntur,Molly_Kertzmann@tristin.me
293,qui sint hic,Kailee.Larkin@amina.org
294,autem totam necessitatibus sit sunt minima aut quis,Earnest.Sanford@lane.us
295,ullam dignissimos non aut dolore,Abigail@trudie.com
296,hic eum sed dolore velit cupiditate quisquam ut inventore,Name.Walter@zoie.me
297,dignissimos dolor facere,Norma@abraham.co.uk
298,ipsam ut labore voluptatem quis id velit sunt,Norberto_Weimann@ford.tv
299,laborum asperiores nesciunt itaque,Nelson@charlene.biz
300,in dolore iusto ex molestias vero,Letha@liliane.ca
301,id voluptatibus voluptas occaecati quia sunt eveniet et eius,Tiana@jeramie.tv
302,quia voluptatem sunt voluptate ut ipsa,Lindsey@caitlyn.net
303,excepturi itaque laudantium reiciendis dolorem,Gregory.Kutch@shawn.info
304,voluptatem quidem animi sit est nemo non omnis molestiae,Murphy.Kris@casimer.me
305,non cum consequatur at nihil aut fugiat delectus quia,Isidro_Kiehn@cristina.org
306,omnis nisi libero,Kenton_Carter@yolanda.co.uk
307,id ab commodi est quis culpa,Amos_Rohan@mozelle.tv
308,enim ut optio architecto dolores nemo quos,Timothy_Heathcote@jose.name
309,maiores et quisquam,Otilia.Daniel@elvie.io
310,sed qui atque,Toni@joesph.biz
311,veritatis nulla consequatur sed cumque,Brisa@carrie.us
312,libero et distinctio repudiandae voluptatem dolores,Jasen.Kihn@devon.biz
313,quia enim et,Efren.Konopelski@madisyn.us
314,enim voluptatem quam,Demetris.Bergnaum@fae.io
315,maxime nulla perspiciatis ad quo quae consequatur quas,Luella.Pollich@gloria.org
316,totam est minima modi sapiente nobis impedit,Sister.Morissette@adelia.io
317,iusto pariatur ea,Shyanne@rick.info
318,vitae porro aut ex est cumque,Freeman.Dare@ada.name
319,et eos praesentium porro voluptatibus quas quidem explicabo est,Donnell@orland.org
320,fugiat eos commodi consequatur vel qui quasi,Robin@gaylord.biz
321,rem ducimus ipsam ut est vero distinctio et,Danyka_Stark@jedidiah.name
322,ipsam et commodi,Margarita@casper.io
323,et aut non illo cumque pariatur laboriosam,Carlo@cortney.net
324,ut ut architecto vero est ipsam,Mina@nikita.tv
325,odit sit numquam rerum porro dolorem,Violette@naomi.tv
326,voluptatem laborum incidunt accusamus,Lauren.Hodkiewicz@jarret.info
327,quisquam necessitatibus commodi iure eum,Ernestina@piper.biz
328,temporibus ut vero quas,Hettie_Morar@wiley.info
329,quasi beatae sapiente voluptates quo temporibus,Corbin.Hilll@modesto.biz
330,illo ab quae deleniti,Kenyatta@renee.io
331,nemo cum est officia maiores sint sunt a,Don@cameron.co.uk
332,dicta vero voluptas hic dolorem,Jovan@aaliyah.tv
333,soluta dicta pariatur reiciendis,Jeanie.McGlynn@enoch.ca
334,et adipisci laboriosam est modi,Garett_Gusikowski@abigale.me
335,voluptatem accusantium beatae veniam voluptatem quo culpa deleniti,Doug@alana.co.uk
336,eveniet eligendi nisi sunt a error blanditiis et ea,Yoshiko@viviane.name
337,beatae esse tenetur aut est,Micaela_Bins@mertie.us
338,qui sit quo est ipsam minima neque nobis,Loy@gillian.me
339,accusantium et sit nihil quibusdam voluptatum provident est qui,Tyrel@hunter.net
340,rerum et quae tenetur soluta voluptatem tempore laborum enim,Otilia.Schuppe@randal.com
341,sunt ut voluptatem cupiditate maxime dolores eligendi,April@larissa.co.uk
342,corporis at consequuntur consequatur,Glenna_Waters@retha.me
343,repellat sed consequatur suscipit aliquam,Cordelia.Oberbrunner@peyton.com
344,blanditiis rerum voluptatem quaerat modi saepe ratione assumenda qui,Zander@santino.net
345,ut deleniti autem ullam quod provident ducimus enim explicabo,Camila_Runolfsdottir@tressa.tv
346,beatae in fuga assumenda dolorem accusantium blanditiis mollitia,Kirstin@tina.info
347,tenetur id delectus recusandae voluptates quo aut,Anthony.Koepp@savannah.tv
348,molestias natus autem quae sint qui,Bradley.Lang@marilyne.tv
349,odio maiores a porro dolorum ut pariatur inventore,Loren@aric.biz
350,eius quia pariatur,Arjun@natalie.ca
351,quia ex perspiciatis sunt voluptatem quidem,Solon.Goldner@judah.org
352,sit ipsam voluptatem velit,Nina@osbaldo.name
353,consequatur reprehenderit similique vitae dolor debitis,Madaline@marlin.org
354,eligendi tempora eum deserunt,Mike.Kozey@gladyce.us
355,reiciendis ad ea,Orval.Treutel@arnold.me
356,qui vel id qui est,Trent@samir.net
357,consectetur totam fugit et occaecati minima aliquid hic adipisci,Ashleigh@annette.ca
358,accusantium natus ex et consequuntur neque,Douglas@anabel.org
359,esse quia quidem quisquam consequatur nisi deleniti,Lowell@mossie.com
360,rerum tempore facilis ut quod sit,Jacquelyn@kristian.net
361,voluptates qui et corporis,Antwon@domenico.me
362,quia qui quia qui,Kenyon@retha.me
363,nihil consequatur quibusdam,Ben@elouise.net
364,vel architecto assumenda et maiores,Madisen.Hauck@barney.co.uk
365,aliquam officiis omnis,Dock.Parker@roy.biz
366,aperiam ut deserunt minus quo dicta nisi,Pablo.Ritchie@tyrique.co.uk
367,praesentium eos quam eius optio eveniet,Sebastian_Gaylord@freda.org
368,fugiat aliquid sint,Lazaro@nadia.ca
369,qui incidunt vel iusto eligendi amet quia qui,Jessy.Boyle@vernice.biz
370,libero vero voluptatum sed facilis quos aut reprehenderit ad,Mitchel@hal.co.uk
371,ut quia sequi sed eius voluptas,Lindsay@kiley.name
372,qui cumque eos consequatur fuga ut,Erika.Murazik@jorge.me
373,nemo voluptatum quo qui atque,Olin@edmund.ca
374,quam exercitationem alias totam,Lacey@novella.biz
375,similique doloribus odit quas magnam omnis dolorem dolore et,Sister@miller.net
376,dolorem qui architecto provident,Raphaelle@miller.com
377,nemo hic sapiente placeat quidem omnis,Jaren.Schiller@augusta.org
378,vitae aut perspiciatis quia enim voluptas,Nikko_Reynolds@harry.me
379,est qui quos exercitationem,Afton.Medhurst@mina.info
380,similique fugiat tenetur ea incidunt numquam,Wilson.Nikolaus@fredrick.org
381,sint porro optio voluptatem,Tomasa@lee.us
382,eius itaque ut ipsa quia quis labore,Ally_Kassulke@rashad.ca
383,provident voluptas perferendis quibusdam libero,Reagan_Ziemann@ross.io
384,et et voluptas et eligendi distinctio accusantium temporibus enim,Angelita@sally.org
385,qui voluptates molestias necessitatibus eos odio quo minima,Lonzo@lorena.org
386,temporibus minus debitis deleniti repellat unde eveniet,Alexandre@derrick.co.uk
387,magnam nihil delectus dolor natus ab ea et,Judd@lucinda.ca
388,laudantium quibusdam blanditiis pariatur non vero deleniti a perferendis,Eleanora@karson.net
