Номер_id,Заголовок,Почта
389,excepturi nam cum molestiae et totam voluptatem nisi,Enrico_Feil@liana.biz
390,temporibus aut et,Beverly@perry.org
391,sed ratione nesciunt odit expedita,Corene_Mante@rory.com
392,rerum officiis qui quaerat omnis dolorem iure est repudiandae,Emily_Flatley@ephraim.name
393,illo quis nostrum accusantium architecto et aliquam ratione,Donna@frederik.com
394,reprehenderit eos voluptatem ut,Kyleigh@ruben.org
395,excepturi esse laborum ut qui culpa,Noemy.Hammes@lisette.net
396,qui eos vitae possimus reprehenderit voluptatem voluptatem repellendus,Margarett_Jenkins@harley.us
397,quasi exercitationem molestias dolore non non sed est,Dexter.Pacocha@lauren.biz
398,labore consequuntur vel qui,Gennaro@jaunita.co.uk
399,sunt ut eos,Jaycee@aimee.us
400,quia aut consequatur sunt iste aliquam impedit sit,Brennon@carmela.tv
401,cum voluptate sint voluptas veritatis,Vella.Mayer@colten.net
402,ut eos mollitia eum eius,Caleb_Dach@kathleen.us
403,architecto voluptatum eos blanditiis aliquam debitis beatae nesciunt dolorum,Patience_Bahringer@dameon.biz
404,officia qui ut explicabo eos fugit,Destinee.Simonis@jose.tv
405,incidunt commodi voluptatem maiores asperiores blanditiis omnis ratione,Keshaun@brown.biz
406,sint eaque rerum voluptas fugiat quia qui,Merle.Schultz@marcel.org
407,eius tempora sint reprehenderit,Malvina_Fay@louie.name
408,non excepturi enim est sapiente numquam repudiandae illo,Domenick_Douglas@gabe.us
409,dicta dolor voluptate vel praesentium,Isaac@allene.net
410,et dolore hic a cupiditate beatae natus iusto soluta,Marianna.Pacocha@george.net
411,hic rem eligendi tenetur ipsum dolore maxime eum,Sister_Barton@lela.com
412,quaerat et quia accusamus provident earum cumque,Autumn.Lebsack@kasandra.ca
413,atque porro quo voluptas,Irma.OKon@arden.me
414,ut qui voluptatem hic maxime,Alaina_Hammes@carter.info
415,rerum consequatur ut et voluptate harum amet accusantium est,Alia@addison.org
416,neque nemo consequatur ea fugit aut esse suscipit dolore,Aurelie_McKenzie@providenci.biz
417,quia reiciendis nobis minima quia et saepe,May_Steuber@virgil.net
418,nesciunt voluptates amet sint et delectus et dolore culpa,Tessie@emilie.co.uk
419,omnis voluptate dolorem similique totam,Priscilla@colten.org
420,aut recusandae a sit voluptas explicabo nam et,Aylin@abigale.me
421,non eligendi ipsam provident,Holden@kenny.io
422,sit molestiae corporis,Guillermo_Dare@dorothea.tv
423,assumenda iure a,Oscar@pearline.com
424,molestiae dolores itaque dicta earum eligendi dolores,Jonathon_Feest@maxime.io
425,cumque expedita consequatur qui,Micah_Wolf@lennie.co.uk
426,deleniti tempora non quia et aut,Shany@daisha.biz
427,delectus illum minus odit,Drew_Lemke@alexis.net
428,voluptas dolores dolor nisi voluptatem ratione rerum,Karina.Donnelly@liam.com
429,sed omnis dolore aperiam,Ahmed_Runolfsson@claire.name
430,sint ullam alias et at et,Marilou_Halvorson@kane.io
431,velit incidunt ut accusantium odit maiores quaerat,Bernie.Schoen@seamus.co.uk
432,quod quia nihil nisi perferendis laborum blanditiis tempora eos,Joesph@darryl.net
433,qui ea voluptatem reiciendis enim enim nisi aut,Timmothy.Corwin@augustus.co.uk
434,doloremque eligendi quas voluptatem non quos ex,Julien_OHara@vance.io
435,id voluptatum nulla maiores ipsa eos,Susan.Bartell@euna.org
436,ea illo ab et maiores eaque non nobis,Selena.Quigley@johan.co.uk
437,magni asperiores in cupiditate,Clifton_Boehm@jacynthe.io
438,ullam autem aliquam,Lizzie_Bartell@diamond.net
439,voluptates quasi minus dolorem itaque nemo,Yasmeen@golda.ca
440,adipisci sapiente libero beatae quas eveniet,Adolf.Russel@clark.ca
441,nisi qui voluptates recusandae voluptas assumenda et,Elian@matilda.me
442,sed molestias sit voluptatibus sit aut alias sunt inventore,Salma@francis.net
443,illum pariatur aliquam esse nisi voluptas quisquam ea,Orlando_Dickinson@vern.org
444,incidunt aut qui quis est sit corporis pariatur qui,Elda@orval.name
445,temporibus adipisci eveniet libero ullam,Dennis@karley.net
446,dicta excepturi aut est dolor ab dolores rerum,Jedediah@mason.io
447,molestiae qui quod quo,Maryam@jack.name
448,pariatur consequatur sit commodi aliquam,Rick@carlos.tv
449,sunt quia soluta quae sit deleniti dolor ullam veniam,Vallie@jerrod.net
450,dolorem corporis facilis et,Adolph.Hayes@isobel.biz
451,maiores ut dolores quo sapiente nisi,Duane_Dach@demario.us
452,quia excepturi in harum repellat consequuntur est vel qui,General@schuyler.org
453,doloremque ut est eaque,Stephania_Stanton@demond.biz
454,magni quos voluptatibus earum et inventore suscipit,Reinhold.Schiller@kelly.info
455,assumenda qui et aspernatur,Royce@jaiden.co.uk
456,quod voluptatem qui qui sit sed maiores fugit,Cassie@diana.org
457,ipsa animi saepe veritatis voluptatibus ad amet id aut,Jena.OKeefe@adonis.net
458,fugiat consectetur saepe dicta,Magdalen@holly.io
459,nesciunt numquam alias doloremque minus ipsam optio,Nyah@otho.com
460,eum fugit omnis optio,Kara_Stokes@connie.co.uk
461,perferendis nobis praesentium accusantium culpa et et,Conner@daron.info
462,assumenda quia sint,Nathanael@jada.org
463,cupiditate quidem corporis totam tenetur rem nesciunt et,Nicklaus@talon.io
464,quisquam quaerat rerum dolor asperiores doloremque,Jerald@laura.io
465,est sunt est nesciunt distinctio quaerat reprehenderit in vero,Jamey_Dare@johnny.org
466,impedit autem distinctio omnis ipsam voluptas eaque,Brant@yasmin.co.uk
467,voluptas unde perferendis ut eaque dicta,Adrianna_Howell@molly.io
468,nam praesentium est ipsa libero aut,Amiya.Morar@emma.tv
469,vel eum quia esse sapiente,Destany@bailey.info
470,deleniti vitae alias distinctio dignissimos ab accusantium pariatur dicta,Katarina.Wolff@joel.io
471,nihil ad debitis rerum optio est cumque sed voluptates,Pearline@veda.ca
472,aspernatur ex dolor optio,Belle.Braun@otis.name
473,quaerat et excepturi autem animi fuga,Eliane@libby.net
474,natus consequatur deleniti ipsum delectus,Trey.Harber@christop.biz
475,cumque consequuntur excepturi consequatur consequatur est,Kailyn@ivory.info
476,quia hic adipisci modi fuga aperiam,Amely.Kunde@rodrigo.co.uk
477,ut occaecati non,Thaddeus.Halvorson@ruthe.ca
478,quo error dignissimos numquam qui nam fugit voluptates et,Hannah@emma.ca
479,distinctio minima error aspernatur reiciendis inventore quo,Maryam.Mann@thelma.info
480,accusantium quo error repudiandae,Michel@keira.us
481,recusandae dolor similique autem saepe voluptate aut vel sit,Domenick@russell.ca
482,placeat eveniet sunt ut quis,Chanelle@samson.me
483,a ipsa nihil sed impedit,Hermann.Kunde@rosina.us
484,hic inventore sint aut,Olen@bryce.net
485,enim asperiores illum,Lorenza.Carter@consuelo.ca
486,et aut qui eaque porro quo quis velit rerum,Lamont@georgiana.biz
487,sunt omnis aliquam labore eveniet,Colin_Gutkowski@muriel.net
488,quo neque dolorem dolorum non incidunt,Albert@johnny.biz
489,aut quia et corporis voluptas quisquam voluptatem,Hilma.Kutch@ottilie.info
490,et eum provident maxime beatae minus et doloremque perspiciatis,Donnie@alfreda.biz
491,eos enim odio,Maxwell@adeline.me
492,consequatur alias ab fuga tenetur maiores modi,Amina@emmet.org
493,ut praesentium sit eos rerum tempora,Gilda@jacques.org
494,molestias facere soluta mollitia totam dolorem commodi itaque,Kadin@walter.io
495,dolor ut ut aut molestiae esse et tempora numquam,Alice_Considine@daren.com
496,et occaecati asperiores quas voluptas ipsam nostrum,Zola@lizzie.com
497,doloribus dolores ut dolores occaecati,Dolly@mandy.co.uk
498,dolores minus aut libero,Davion@eldora.net
499,excepturi sunt cum a et rerum quo voluptatibus quia,Wilburn_Labadie@araceli.name
500,ex eaque eum natus,Emma@joanny.ca
